{
  "contract_version": "1.2.0",
  "status": "BLOCKED",
  "reason_code": "QUOTE_DIALECT_AMBIGUOUS",
  "local_file_deleted": true,
  "logical_deletion_only": true,
  "physical_secure_erasure_guaranteed": false,
  "archive_byte_count": 409477526,
  "schema_result": {
    "contract_version": "1.0.0",
    "status": "BLOCKED",
    "reason_code": "QUOTE_DIALECT_AMBIGUOUS",
    "source_id": "ny.osc.unclaimed_funds.owner_name_file",
    "gate_id": "HUMAN_NY_OSC_OWNER_NAME_FILE_FIRST_DOWNLOAD_TRANSIENT_PII_AUTHORIZATION",
    "approval_id": "OWNER_APPROVAL_2026-09-21_NY_OSC_SIXTH_BOUNDED_TRANSIENT_PII_ATTEMPT_ONCE_35566615",
    "archive_byte_count": 409477526,
    "archive_member_count": 1,
    "member_names_persisted": false,
    "selected_text_member_present": true,
    "selected_member_uncompressed_bytes": 1939569781,
    "observed_delimiter": "|",
    "documented_layout_field_count": 14,
    "observed_data_field_count": null,
    "observed_header_state": "NO_HEADER_OBSERVED",
    "physical_header_names": [],
    "aggregate_complete_record_count": 165438,
    "property_type_code_column_index_zero_based": 1,
    "property_type_ascii_record_count": 165438,
    "nature_of_property_mapping_state": "NOT_CONFIRMED",
    "encoding_state": "NOT_EVALUATED_BYTE_LEVEL_DISCOVERY_ONLY",
    "raw_file_persisted": false,
    "owner_rows_persisted": false,
    "owner_field_logging": false,
    "row_specific_human_inspection": false,
    "no_owner_values_returned": true
  },
  "schema_discovery_quote_dialect_mode": "LINE_LOCAL_ARBITRATION",
  "structural_diagnostic": null,
  "quote_dialect_diagnostic": {
    "contract_version": "1.0.0",
    "source_id": "ny.osc.unclaimed_funds.owner_name_file",
    "diagnostic_scope": "QUOTE_DIALECT_STRUCTURAL_ONLY",
    "reason_code": "QUOTE_DIALECT_AMBIGUOUS",
    "classification": "LINE_END_AND_FIELD_COUNT_DIVERGENCE",
    "expected_field_count": 14,
    "raw_field_count": 14,
    "quote_aware_field_count": 6,
    "raw_pipe_count": 13,
    "quote_aware_structural_pipe_count": 5,
    "suppressed_pipe_count": 8,
    "quote_byte_count": 1,
    "quote_open_event_count": 1,
    "quote_close_event_count": 0,
    "doubled_quote_pair_count": 0,
    "ended_inside_quote": true,
    "no_raw_record_returned": true,
    "no_owner_values_returned": true
  },
  "no_raw_path_returned": true,
  "no_owner_values_returned": true
}
